{
  "entry_id": "uuid-9002",
  "ts": "2025-08-29T13:45:01Z",
  "type": "spotcheck_event",
  "ref": "probe-42",
  "meta": {
    "spotcheck_event": {
      "outcome": "ambiguous_evidence",
      "severity": "low",
      "escalated": false,
      "details": "Suggest CONTRARY or CHECK lens"
    }
  }
}

